<?xml version="1.0" encoding="UTF-8"?>
<!DOCTYPE imobiliaria [
  <!ELEMENT imobiliaria (imovel+)>
  <!ELEMENT imovel (descricao, proprietario, endereco, caracteristicas, valor)>
  <!ELEMENT descricao (#PCDATA)>
  <!ELEMENT proprietario (nome, (email | telefone)+)>
  <!ELEMENT nome (#PCDATA)>
  <!ELEMENT email (#PCDATA)>
  <!ELEMENT telefone (#PCDATA)>
  <!ELEMENT endereco (rua, bairro, cidade, numero?)>
  <!ELEMENT rua (#PCDATA)>
  <!ELEMENT bairro (#PCDATA)>
  <!ELEMENT cidade (#PCDATA)>
  <!ELEMENT numero (#PCDATA)>
  <!ELEMENT caracteristicas (tamanho, numQuartos, numBanheiros)>
  <!ELEMENT tamanho (#PCDATA)>
  <!ELEMENT numQuartos (#PCDATA)>
  <!ELEMENT numBanheiros (#PCDATA)>
  <!ELEMENT valor (#PCDATA)>
]>
<imobiliaria>
  <imovel>
    <descricao>Apartamento amplo com varanda e vista para a praia.</descricao>
    <proprietario>
      <nome>Mariana Souza</nome>
      <telefone>(85) 99999-1111</telefone>
      <telefone>(85) 98888-2222</telefone>
      <email>mariana.souza@email.com</email>
    </proprietario>
    <endereco>
      <rua>Avenida Beira Mar</rua>
      <bairro>Meireles</bairro>
      <cidade>Fortaleza</cidade>
      <numero>1200</numero>
    </endereco>
    <caracteristicas>
      <tamanho>95 m2</tamanho>
      <numQuartos>3</numQuartos>
      <numBanheiros>2</numBanheiros>
    </caracteristicas>
    <valor>780000</valor>
  </imovel>

  <imovel>
    <descricao>Casa térrea com quintal espaçoso e garagem.</descricao>
    <proprietario>
      <nome>João Pereira</nome>
      <telefone>(85) 97777-3333</telefone>
    </proprietario>
    <endereco>
      <rua>Rua das Acácias</rua>
      <bairro>Aldeota</bairro>
      <cidade>Fortaleza</cidade>
      <numero>245</numero>
    </endereco>
    <caracteristicas>
      <tamanho>140 m2</tamanho>
      <numQuartos>4</numQuartos>
      <numBanheiros>3</numBanheiros>
    </caracteristicas>
    <valor>920000</valor>
  </imovel>

  <imovel>
    <descricao>Kitnet compacta ideal para estudantes.</descricao>
    <proprietario>
      <nome>Larissa Mendes</nome>
      <email>larissa.mendes@email.com</email>
      <telefone>(85) 96666-4444</telefone>
    </proprietario>
    <endereco>
      <rua>Rua Professor Costa Mendes</rua>
      <bairro>Benfica</bairro>
      <cidade>Fortaleza</cidade>
    </endereco>
    <caracteristicas>
      <tamanho>32 m2</tamanho>
      <numQuartos>1</numQuartos>
      <numBanheiros>1</numBanheiros>
    </caracteristicas>
    <valor>165000</valor>
  </imovel>

  <imovel>
    <descricao>Cobertura duplex com área de lazer privativa.</descricao>
    <proprietario>
      <nome>Carlos Henrique Lima</nome>
      <telefone>(85) 95555-5555</telefone>
      <email>carlos.lima@email.com</email>
    </proprietario>
    <endereco>
      <rua>Rua Barbosa de Freitas</rua>
      <bairro>Dionísio Torres</bairro>
      <cidade>Fortaleza</cidade>
      <numero>890</numero>
    </endereco>
    <caracteristicas>
      <tamanho>210 m2</tamanho>
      <numQuartos>4</numQuartos>
      <numBanheiros>4</numBanheiros>
    </caracteristicas>
    <valor>1350000</valor>
  </imovel>

  <imovel>
    <descricao>Casa em condomínio com segurança 24 horas.</descricao>
    <proprietario>
      <nome>Fernanda Alves</nome>
      <telefone>(85) 94444-6666</telefone>
      <email>fernanda.alves@email.com</email>
    </proprietario>
    <endereco>
      <rua>Avenida Washington Soares</rua>
      <bairro>Edson Queiroz</bairro>
      <cidade>Fortaleza</cidade>
      <numero>3500</numero>
    </endereco>
    <caracteristicas>
      <tamanho>180 m2</tamanho>
      <numQuartos>3</numQuartos>
      <numBanheiros>3</numBanheiros>
    </caracteristicas>
    <valor>1100000</valor>
  </imovel>
</imobiliaria>
